{
  "$schema": "https://json-schema.org/draft/2020-12/schema",
  "$id": "https://github.com/redlynx101/swarmkit/docs/receipts.schema.json",
  "title": "Swarmkit Receipt",
  "description": "Machine-verifiable record for agent-run changes.",
  "type": "object",
  "additionalProperties": false,
  "required": [
    "version",
    "goal",
    "changes",
    "verification",
    "timestamp",
    "actor"
  ],
  "properties": {
    "version": {
      "type": "string",
      "const": "1.0"
    },
    "goal": {
      "type": "string",
      "minLength": 1
    },
    "changes": {
      "type": "array",
      "minItems": 1,
      "items": {
        "type": "string",
        "minLength": 1
      }
    },
    "verification": {
      "type": "array",
      "minItems": 1,
      "items": {
        "type": "object",
        "additionalProperties": false,
        "required": ["command", "expect"],
        "properties": {
          "command": {
            "type": "string",
            "minLength": 1
          },
          "expect": {
            "type": "string",
            "minLength": 1
          }
        }
      }
    },
    "risks": {
      "type": "array",
      "items": {
        "type": "string",
        "minLength": 1
      },
      "default": []
    },
    "files_touched": {
      "type": "array",
      "items": {
        "type": "string",
        "minLength": 1
      },
      "default": []
    },
    "timestamp": {
      "type": "string",
      "format": "date-time"
    },
    "actor": {
      "type": "string",
      "minLength": 1
    },
    "links": {
      "type": "array",
      "items": {
        "type": "string",
        "format": "uri"
      },
      "default": []
    }
  }
}
